Question,Answer A,Answer B,Answer C,Answer D,Answer E
Un acido di Brønsted-Lowry è una specie chimica:,in grado di donare ioni H+,aggressiva,in grado di cedere elettroni,in grado di donare elettroni,che reagisce in acqua
In KCl il cloro è legato al potassio attraverso un legame:,ionico,covalente puro,covalente polare,metallico,dipolo-dipolo
Quale dei seguenti elementi NON si presenta allo stato elementare come molecola biatomica?,Elio,Ossigeno,Azoto,Idrogeno,Cloro
Una bombola contiene 15 L di gas metano. Se ne prelevano 3 litri: qual è il volume del gas residuo?,15 L,12 L,5 L,14 L,13 L
Si definiscono isomeri i composti diversi che:,presentano la stessa formula molecolare,presentano le stesse proprietà chimiche,appartengono alla stessa classe di composti organici,differiscono solo per la presenza di legami multipli,differiscono solo per la presenza di isotopi
"Quante moli di LiOH sono contenute in 6,0 litri di soluzione acquosa di LiOH con pH = 8?","6,0 x 10-6","1,0 x 10-12","6,0 x 10-8",1e-06,Non si può dire in quanto LiOH non è una base forte
Calcolare la molarità di una soluzione ottenuta sciogliendo 8 g di NaOH (40 g/mol) in 150 mL di acqua.,"1,33 M",2 M,"0,13 M","0,6 M","0,26 M"
"Tra i seguenti legami, qual è il più lungo?",Il legame semplice tra due atomi di C,Il legame doppio tra due atomi di C,Il legame triplo tra due atomi di C,Il legame doppio tra un atomo di C e uno di O,Il legame triplo tra due atomi di azoto
Gli orbitali ibridi sp3 formano angoli di:,"109,5°",120°,180°,nessuna delle altre alternative è corretta,90°
La temperatura di ebollizione dell'acqua a 2.500 m di altitudine rispetto a quella del livello del mare:,è minore,resta invariata,è il doppio,è la metà,è maggiore
Gli alcani presentano:,nessun legame multiplo tra atomi di carbonio,almeno un legame triplo tra due atomi di carbonio,almeno un legame doppio tra due atomi di carbonio,un sistema elettronico π delocalizzato,almeno un legame doppio tra atomi di carbonio e un anello planare stabilizzato da legami π
Il legame ionico è:,un legame di natura elettrostatica,un legame covalente eteropolare,un legame tra due atomi uguali,un debole legame di interazione elettrostatica tra molecole di solvente e soluto,un legame tra due molecole in soluzione non acquosa
Qual è la configurazione elettronica del catione Na+ e dell'atomo di Ar? (Si tenga conto che entrambi gli elementi appartengono al periodo 3).,1s2 2s2 2p6 e 1s2 2s2 2p6 3s2 3p6 rispettivamente,1s2 2s2 2p6 3s2 3p6e 1s2 2s2 2p1 3s2 3p6 3d10 rispettivamente,1s2 2s2 2p6 e 1s2 2s2 2p6 3s2 3p6 3d10 rispettivamente,1s2 2s2 2p6 per entrambi,1s2 2s1 e 1s2 2s2 2p1 rispettivamente
"Tra le tante funzioni svolte dalle proteine, le più importanti sono:",enzimatiche e strutturali,accumulare e cedere energia,scheletriche,mantenere costante la temperatura corporea,nessuna delle altre alternative è corretta
Quale tra le seguenti affermazioni relative ai metalli è corretta?,Possiedono una bassa elettronegatività,Nella tavola periodica sono meno numerosi dei non metalli,A temperatura ambiente sono tutti solidi,Sono localizzati esclusivamente nella parte destra della tavola periodica,Possiedono un'alta affinità elettronica
Quale tra i seguenti atomi ha il raggio più grande?,Cs,K,Na,Li,O
"In 250 millilitri di una soluzione 0,30 M (molare) di un composto sono contenute:","0,075 moli","1,2 moli","0,15 moli","0,3 moli","0,6 moli"
Quale dei seguenti composti si prevede sia insolubile in acqua?,FeS,NaBr,NH4Cl,(NH4)2S,K2CO3
A quante moli corrispondono 31 g di H2CO3?,0.5,2,5,0.2,10
In quale dei seguenti composti il carbonio presenta il numero di ossidazione più basso?,C2H4,CaCO3,HCHO,Mg(HCO3)2,CO2
"Sapendo che il numero di massa di un atomo è 15 e che il suo numero atomico è 7, ne segue che il numero di neutroni contenuti nel sopradescritto atomo è:",8,15,7,14,22
"Si definisce ""racemo"":",una miscela in parti uguali di due enantiomeri,una miscela in parti uguali di due diasteroisomeri,un composto otticamente attivo,un composto con due centri chirali equivalenti,una qualsiasi miscela di due enantiomeri
La massa di 2 moli di H3AsO4 è pari a 284 g. Qual è il peso atomico relativo di un atomo di arsenico?,75 u,76 g,288 u,221 u,"82,5 u"
La reazione con acido iodidrico di una molecola di C3H8O dà come unici prodotti una molecola di CH3I e ad una molecola di CH3CH2OH. Sulla base di queste informazioni a quale classe di composti della chimica organica deve appartenere C3H8O?,Eteri asimmetrici o misti,Chetoni,Anidridi,Eteri semplici o simmetrici,Esteri
"Quanti grammi di una soluzione acquosa al 10,6% (concentrazione percentuale massa/massa) di carbonato di sodio sono necessari per ottenere 0,01 moli di carbonato di sodio? (massa atomica di Na = 23 u)",10,5.03,74,1.06,100
Acqua ed esano non sono miscibili tra loro. Qualora vengano posti nello stesso recipiente si ottiene:,un sistema eterogeneo,un'unica fase,un sistema omogeneo,una soluzione,un colloide
"Una soluzione è saturata contemporaneamente con CaSO4 (pKps = 4,7) e con BaSO4 (pKps = 9,9). Indicare quale delle seguenti relazioni tra le
concentrazioni è corretta.",[Ba2+] < [Ca2+],[Ba2+] > [Ca2+],[Ba2+] = [Ca2+],"2–
[Ba2+] = [SO4    ]","2–
[Ba2+] > [SO4    ]"
Quale tra le seguenti affermazioni sugli alcani NON è corretta?,Sono idrocarburi insaturi,Hanno formula generale CnH2n+2,Rappresentano una serie omologa,Gli atomi di carbonio degli alcani sono legati da legami singoli,Sono denominati anche paraffine
Quale dei seguenti materiali NON si trova in natura?,Bachelite,Bauxite,Ambra,Carbone,Ematite
Qual è la struttura spaziale di una ibridazione sp3?,Tetraedrica,Quadrata,Cubica,Cilindrica,Lineare
Quale delle seguenti coppie è costituita da particelle aventi la stessa configurazione elettronica esterna?,Cl–; K+,Ga; Ge,He; Ca+,O–; P,Li+; Ba+
Gli elettroliti sono sostanze:,che in acqua si dissociano in ioni,insolubili in acqua,solubili nei grassi,che in acqua non si dissociano in ioni,che allo stato solido conducono la corrente elettrica
"Il magnesio forma un composto ionico chiamato fluoruro di magnesio. Per la formazione di tale composto, quanti elettroni cede ciascun atomo di magnesio agli atomi di fluoro?",2,1,3,4,nessuna delle altre risposte è corretta
La produzione di etanolo per fermentazione avviene da parte di:,lieviti,composti acidi presenti nel mosto,cellule vegetali presenti nell'uva,muffe,radiazioni UV
Le reazioni di eliminazione E2 sono:,favorite con basi forti,favorite con basi deboli e nucleofili forti,sfavorite dalla bassa pressione,di un solo tipo,sfavorite ad alta temperatura
La sublimazione è il passaggio di stato:,solido-vapore,vapore-liquido,vapore-solido,solido-liquido,liquido-solido
In quale delle seguenti reazioni chimiche l'unico prodotto che si forma è un sale?,CO2 + CaO → ...,N2 + 3H2 → ...,2 HCl + K2O → ...,H2SO3 + 2 KOH → ...,2 NO + O2 → ...
Gli enzimi sono:,proteine con attività catalitica,macromolecole biologiche legate alla divisione cellulare,molecole informazionali,attivatori della sintesi proteica,molecole biologiche che contengono informazioni genetiche
Considerando la reazione reversibile H2O + CO2 → H2CO3 → H+ + HCO3– si può dedurre che a livello dei capillari sistemici:,aumenta la quantità di HCO3–,la reazione non muta il suo equilibrio,diminuisce la quantità HCO3–,aumenta la quantità di CO2,la reazione è spostata verso sinistra
La reazione tra acido solforico e saccarosio porta principalmente alla formazione di acqua e carbonio. Questa reazione si può classificare come:,disidratazione,doppio scambio,idratazione,addizione,sintesi
"Si consideri una soluzione acquosa di Ca(NO3)2 0,4 M. Quante moli di atomi di azoto sono contenute in 800 ml di tale soluzione a causa della presenza di Ca(NO3)2?",0.64,0.32,0.8,1.92,0.4
In una mole di H2SO4 ci sono:,"due moli di H, una mole di S e quattro moli di O","una mole di H, una mole di S e una mole di O","due grammi di H, un grammo di S e quattro grammi di O","un grammo di H, un grammo di S e un grammo di O","uno stesso numero di atomi di H, S e O"
Il propene ha formula bruta:,C3H6,C4H10,C4H8,C3H4,C3H8
Il valore del pH di una soluzione ottenuta sciogliendo in acqua pura un sale stechiometricamente neutro:,dipende dalla natura degli ioni che compongono il sale,è uguale a 7,è minore di 7,è maggiore di 7,è compreso fra 6 e 8
Quanti grammi pesano 2 moli di acqua?,Nessuna delle altre alternative è corretta,8,18,24,2
"Individuare i coefficienti stechiometrici necessari per il corretto bilanciamento della massa della seguente equazione chimica:
NaOH + H3PO4 → Na3PO4 + H2O","3, 1, 1, 3","3, 1, 3, 1","2, 1, 1, 2","2, 1, 3, 1","3,1, 1, 2"
"Qual è il valore numerico del coefficiente stechiometrico b necessario per bilanciare la seguente equazione chimica:
2 CrI3 + 64 KOH + a Cl2 → 2 K2CrO4 + b KIO4 + c KCl + 32 H2O?",b = 6,b = 4,b = 5,b = 3,b = 7
In quale dei seguenti composti si ha una catena di 4 atomi di carbonio?,Butanolo,Aldeide acetica,Propano,Glicerina,Etino
"La massa di Mg è pari a 24,3 u, la massa di N è pari a 14 u e la massa di O è pari a 16 u. Quale delle seguenti affermazioni è corretta? La massa di una mole di Mg(NO2)2 è pari a:","116,3 g","114,3 u","70,3 g","84,3 u","118,3 x 1,67 x 1023 g"
Il composto HCl:,presenta legame covalente polare,presenta legame ionico,presenta legame covalente non polare,presenta legame a idrogeno,è polare solo quando viene disciolto in acqua
Un gruppo COOH è caratteristico:,degli acidi carbossilici,degli alcoli,delle aldeidi,dei chetoni,degli esteri
Si consideri un litro di soluzione contenente 75 mg di NaCl in ciascun millilitro. A questa soluzione quanti litri di acqua devono essere aggiunti o tolti per ottenere una soluzione che contiene 15 mg di NaCl per millilitro?,Devono essere aggiunti 4 litri d'acqua,"Devono essere tolti 0,8 litri d'acqua",Devono essere aggiunti 5 litri d'acqua,"Devono essere tolti 0,2 litri d'acqua","Devono essere aggiunti 4,5 litri d'acqua"
Individuare la sostanza insolubile in acqua o in altri solventi polari.,CaCO3,Na2CO3,K2SO4,LiCl,KOH
"Indicare il numero di ossidazione del carbonio nella molecola HCO  –.
3",4,3,–2,1,–4
"0,1 moli di un composto hanno una massa 9,5 g. Calcolare il peso molecolare.",95 g/mol,102 g/mol,120 g/mol,55 g/mol,87 g/mol
"Il pH di una soluzione di Ca(OH)2 0,005 M è:",12,5,7,2,8
"L'ossido di potassio, posto in acqua, forma:",una soluzione basica,potassio libero,una soluzione acida,un sale,nessuna delle altre alternative è corretta
"Se a temperatura costante si separa per filtrazione una soluzione satura dal soluto presente come corpo di fondo, la soluzione ottenuta:",è comunque satura,non è più satura,resta satura solo se il soluto è un liquido,non è più una soluzione,può essere o non essere satura a seconda della natura del soluto
Il legame tra l'ossigeno e l'idrogeno in una molecola d'acqua è:,covalente,a idrogeno,ionico,dativo,nessuna delle altre alternative è corretta
A quale classe di composti della chimica organica appartiene il composto che ha formula C3H7OH?,Alcoli,Acidi carbossilici,Aldeidi,Chetoni,Eteri
Una sostanza si dice idrofoba se essa:,è insolubile in acqua,è polare,è solubile in acqua,possiede atomi di azoto,è carica negativamente
"Nella tavola periodica degli elementi ciascun gas nobile, eccetto l'elio, è immediatamente preceduto:",da un alogeno,da un metallo alcalino-terroso,da un atomo molto elettropositivo,nessuna delle altre alternative è corretta,da un metallo di transizione
Quale dei seguenti ossidi forma con acqua una sostanza a carattere acido?,CrO3,FeO,Ag2O,CuO,MgO
Una miscela omogenea è composta da:,diverse sostanze pure in una singola fase,un'unica sostanza pura,diverse sostanze pure in fasi diverse,diversi elementi chimici in fasi diverse,diverse forme allotropiche dello stesso elemento in equilibrio chimico tra loro
Perchè si sparge il sale sulle strade ghiacciate?,perché la miscela acqua-sale congela a temperatura inferiore a 0 °C,perché il sale fa asciugare più velocemente l'asfalto,per aumentare l'aderenza degli pneumatici sul ghiaccio,perché il sale abbassa la tensione di vapore del ghiaccio,nessuna delle altre alternative è corretta
"Individuare i coefficienti stechiometrici necessari per bilanciare la seguente equazione chimica:
a NH3 + b O2 → c NO + d H2O",a = 4; b = 5; c = 4; d = 6,a = 2; b = 3; c = 2; d = 3,a = 2; b = 5; c = 4; d = 3,a = 4; b = 6; c = 4; d = 6,a = 3; b = 5; c = 3; d = 6
Un gas ha:,forma e volume del recipiente,forma e volume proprio,forma del recipiente e volume proprio,forma propria e volume del recipiente,solo forma propria
"Una soluzione acquosa di alcol etilico (C2H5OH) è 0,005 molale. Dopo aver considerato in tale soluzione quanto alcol etilico è sciolto in 3.000 g di acqua, si immagini di mescolare la quantità di soluzione di alcol etilico appena menzionata con due litri di soluzione acquosa 0,005 M di alcol
etilico. Qual è la concentrazione molare di alcol etilico della soluzione finale?","Circa 0,005 mol/L","Circa 0,015 mol/L","Circa 0,025 mol/L","Circa 0,05 mol/L","Circa 0,5 mol/L"
Una soluzione acquosa ha pH 12. È dunque:,basica,necessario indicare quale soluto è presente,neutra,acida,nessuna delle altre alternative è corretta
Sciogliendo in acqua pura un sale si ottiene una soluzione:,"acida, basica o neutra a seconda della natura del sale",sempre neutra,"acida, se il sale è formato per reazione di un acido forte con una base forte","acida, se il sale è formato per reazione di una qualsiasi base con un acido forte","basica, se il sale è un elettrolita anfotero"
L'isomeria geometrica o “E o Z” in una molecola organica si può presentare quando:,si ha la presenza di un doppio legame tra due atomi di carbonio,due composti diversi hanno lo stesso peso molecolare,due composti diversi hanno la stessa formula bruta,si ha la presenza di un carbonio chirale,si ha diversa posizione di un sostituente su una catena di atomi di carbonio
Una soluzione 1 N (normale) contiene:,1 grammo equivalente di soluto per litro di soluzione,1 mole di soluto per 1.000 g di solvente,1 grammo di soluto per millimetro cubico di soluzione,1 grammo equivalente di soluto per 1.000 g di solvente,nessuna delle altre alternative è corretta
Un atomo in forma anionica presenta necessariamente:,un numero di elettroni maggiore rispetto al numero di protoni,un numero di elettroni maggiore rispetto al numero di neutroni,un numero di neutroni maggiore rispetto al numero di protoni,un numero di protoni maggiore rispetto al numero di elettroni,"uguale numero di protoni, elettroni e neutroni"
Quale di queste è una reazione di neutralizzazione?,KOH + HCl → KCl + H2O,NaCl → Na+ + Cl-,NaCl + AgNO3 → AgCl + NaNO3,Nessuna delle altre alternative è corretta,Zn + 2 HCl→ ZnCl2 + H2
In una reazione di ossidoriduzione:,il numero di elettroni ceduti dalla specie che si ossida è uguale al numero di elettroni acquistati dalla specie che si riduce,il numero di elettroni ceduti dalla specie che si ossida è maggiore del numero di elettroni acquistati dalla specie che si riduce,il numero di elettroni acquistati dalla specie che si ossida è uguale al numero di elettroni ceduti dalla specie che si riduce,non avviene scambio di elettroni,nessuna delle altre alternative è corretta
Tra quale delle seguenti coppie di elementi si può formare un legame ionico?,Un elemento del gruppo II con un elemento del gruppo VII,Un elemento del gruppo I con un elemento del gruppo III,Un elemento del gruppo VI con un elemento del gruppo VII,Un elemento del gruppo I con un elemento del gruppo VIII,Due elementi del gruppo I
Una soluzione con pH = 7 è da considerarsi:,neutra,basica,debolmente basica,fortemente acida,acida
Quale dei seguenti atomi contiene il maggior numero di neutroni?,"Cs (Z = 55, A = 133)","Sb (Z = 51, A = 123)","Te (Z = 52, A = 128)","I (Z = 53, A = 127)","Sn (Z = 50, A = 120)"
Dall’idratazione di un alchene si ottiene:,un alcol,un alcano,un alchino,un’aldeide,un chetone
I composti con la stessa formula bruta ma differente distribuzione degli atomi nello spazio sono detti:,stereoisomeri,isomeri di struttura,isotopi,anfoteri,inerti
Individuare l’elemento che ha comportamento semimetallico.,Si,S,P,Al,Se
"Indicare quanti neutroni possiede, nello stato fondamentale, l'isotopo del carbonio avente Z = 6 e numero di massa A = 14.",8,12,2,6,16
"Mescolando 1 litro di una soluzione acquosa di bromuro di potassio 0,001 M, 1 litro di soluzione acquosa di solfato di potassio 0,002 M e 2 litri di soluzione acquosa di ipoclorito di potassio 0,0035 M, quale risulta essere la concentrazione del catione potassio nella soluzione ottenuta?","0,003 M","0,0016 M","0,0065 M","0,0025 M","0,00125 M"
"Qual è il pH di una soluzione acquosa 1,0 x 10-2M di acido perclorico?",2,> 2,0 < pH < 1,"Circa 1,5","Circa 2,5"
L'elemento Br:,appartiene al gruppo degli alogeni,corrisponde al Boro,appartiene al gruppo dei metalli alcalino-terrosi,è un elemento di transizione,nessuna delle altre alternative è corretta
L'elio è un:,gas nobile,semimetallo,non metallo,elemento di transizione,metallo
"L'atomo di Se, con numero di massa (A) 80 e numero atomico (Z) 34, contiene nel nucleo:",34 protoni e 46 neutroni,17 protoni e 80 neutroni,7 protoni e 8 neutroni,5 protoni e 2 neutroni,94 neutroni e 46 protoni
Cos'è il glicerolo?,Un alcol con tre gruppi ossidrilici,Un chetone,Un'aldeide,Un alcol con un gruppo ossidrilico,Nessuna delle altre alternative è corretta
"12,06 x 1023 molecole di HReO4 hanno una massa pari a 502 g. Qual è il peso atomico relativo di un atomo di renio?",186 u,279 u,93 u,279 g,186 g
Dalla reazione tra potassio e ossigeno si ricava K2O. Quale delle seguenti affermazioni è FALSA?,K2O reagisce con acqua per dare un ossiacido o acido ossigenato,K2O è un ossido basico,K2O è un composto binario,K2O reagisce con acqua per dare un composto ternario,K2O reagisce violentemente con l'acqua
"Nella reazione AgNO3 + KCl → AgCl + KNO3 quante moli di AgCl si possono ottenere da 2,5 moli di KCl?",2.5,5,2,8,7
Le dimensioni atomiche degli elementi neutri:,diminuiscono lungo un periodo della tavola periodica,aumentano lungo un periodo della tavola periodica,diminuiscono lungo un gruppo della tavola periodica,atomi di uno stesso gruppo della tavola periodica hanno stesse dimensioni,tutti gli elementi neutri hanno le stesse dimensione atomiche
"Il peso molecolare di Na2SO4 (solfato di sodio) è 142,0 g/mol. Per
prelevare una millimole di sostanza bisogna pesarne:","0,142 g","1,42 g","14,2 mg",142 g,"0,0142 g"
Quale delle seguenti affermazioni è vera?,Le masse del neutrone e del protone sono quasi uguali,La massa del neutrone è minore di quella dell'elettrone,La massa del protone è circa il doppio di quella dell'elettrone,La massa di un atomo è determinata solo dai protoni,Le masse dell'elettrone e del protone sono quasi uguali
La DNA polimerasi catalizza la formazione di un legame:,fosfodiestereo,fosfotirosinico,fosfoamminico,peptidico,nucleotidico
"L'acido HClO è un acido debole, per cui il pH di una soluzione del suo sale di calcio [Ca(ClO)2], comunemente addizionato all'acqua delle piscine, è:",basico perché lo ione ClO– ha carattere basico in acqua,acido perché si forma HClO,neutro perché è una soluzione di un sale,basico perché Ca(OH)2 è una base debole e insolubile,"neutro se la concentrazione è inferiore a 0,1 M"
Quale delle seguenti affermazioni è corretta?,Il legame covalente dativo si stabilisce quando la coppia di elettroni condivisi viene fornita solo da uno dei due atomi che formano il legame,L'energia di ionizzazione è l'energia che si libera quando da un atomo neutro si forma un anione,Il volume atomico aumenta da sinistra verso destra lungo uno stesso periodo,Un legame è chiamato doppio quando tra due atomi vengono messi in comune due elettroni,Un protone e un neutrone hanno la stessa carica elettrica e massa differente
Una soluzione contiene 2 moli di soluto in 5 litri di soluzione. Qual è la sua molarità?,"0,4 M",2 M,10 M,"0,5 M","0,2 M"
Quale di queste soluzioni ha la pressione osmotica più bassa (le soluzioni sono alla stessa temperatura)?,"Una soluzione 1,5 molare in glucosio","Una soluzione 1,0 molare in NaCl","Una soluzione 1,25 molare in KCl","Una soluzione 1,6 molare in saccarosio","Una soluzione 2,0 molare in ioni sodio Na+"
Per l'alchilazione di Friedel-Crafts di composti aromatici con alogenuri alchilici si impiegano come catalizzatori:,acidi di Lewis,acidi di Broensted,basi di Lewis,acidi poliprotici,basi forti
"Tra le seguenti soluzioni: acido cloridrico 0,1 M, acido acetico 3 M, ammoniaca 0,5 M, cloruro di sodio 1 M, idrossido di sodio 0,1 M, la soluzione con pH più basso è:",HCl,NH3,CH3COOH,NaCl,NaOH
Il passaggio di una sostanza dallo stato solido a quello liquido si chiama:,fusione,liquefazione,sublimazione,condensazione,solidificazione
La formula molecolare:,può essere uguale o multipla della formula minima,è sempre multipla della formula minima,è uguale alla formula minima,è un sottomultiplo della formula minima,contiene informazioni strutturali
"Alluminio (Al), stagno (Sn) e piombo (Pb):",sono metalli di post-transizione,sono metalloidi,sono metalli alcalino-terrosi,si trovano nello stesso gruppo del ferro (Fe),si trovano nello stesso gruppo del rame (Cu)
Il numero di massa (A) è determinato:,dalla somma tra protoni e neutroni,dalla somma tra protoni ed elettroni,dal numero dei neutroni,dal numero dei protoni,dal numero degli elettroni
Qual è la massa molare del composto con formula C6H12O6?,"180,16 g/mol","180,16 g","180,16 mol","180,16 M","180,16 m"
L'elettrone è una particella di carica negativa:,con una massa 1840 volte minore di quella del protone,con massa 1840 volte maggiore di quella del protone,con una massa uguale a quella del protone,non ha massa,con una massa uguale al neutrone
Che cos'è l'acetato di butile?,Nessuna delle altre alternative è corretta,Un'anidride,Un acido acrbossilico,Un chetone,Un etere
Una soluzione contiene 4 moli di soluto in 36 moli di solvente. Qual è la frazione molare del soluto?,0.1,0.4,4,36,9
Quale delle seguenti affermazioni NON vale per gli elementi alogeni?,Si trovano tutti allo stato gassoso a 25 °C,Nella tavola periodica si trovano nella colonna a sinistra dei gas nobili,Appartengono al gruppo 17 della tavola periodica,Possono formare dei sali con i metalli,Nessuna delle altre alternative è corretta
Il numero atomico del calcio è 20. Qual è il numero totale di elettroni dello ione Ca++?,18,10,20,22,40
Indicare lo ione bicarbonato.,HCO3–,(CO32–)2,"–
H2CO3","2–
CO2",Nessuna delle altre alternative è corretta
Per calcolare il peso atomico del fenantrene:,si effettua la somma algebrica dei pesi degli atomi che compongono il fenantrene,è necessario conoscere la concentrazione di fenantrene in soluzione,è necessario sommare il peso atomico di tutti gli isotopi più leggeri degli atomi che compongono la molecola,è necessario sommare il peso di tutti gli isotopi più pesanti degli atomi che compongono la molecola,è necessario sommare il peso di tutti gli isotopi degli atomi che compongono la molecola e dividere il risultato per il numero di isotopi considerati
Completare in modo corretto. La molalità (m) del soluto di una soluzione rappresenta un modo di esprimere la concentrazione della soluzione. Il suo valore:,non dipende dalla temperatura,dipende dalla temperatura,è dato dalla quantità chimica di soluto presente in 1 L di solvente puro,è dato dalla quantità chimica di soluto presente in 1 L di soluzione,è dato dal rapporto tra le moli n del soluto e le moli totali della soluzione
Qual è il numero di ossidazione del fosforo nell'acido fosforico H3PO4?,5,0,–2,–5,4
Una soluzione acida:,ha un pH inferiore a 7,ha un pH superiore a 7,ha un pH uguale a 7,ha un pOH inferiore a 7,ha un pH superiore a 14
Qual è il metodo più appropriato per separare i componenti di una miscela di acqua e cloruro di sodio?,Distillazione,Filtrazione,Centrifugazione,Decantazione,Nessuno dei metodi indicati nelle altre alternative
Quale di questi gruppi rappresenta un alcol?,ROH,ROR',RCOR',RCOOR',ROOH
La formula minima di un composto indica:,il rapporto tra gli atomi nella molecola,la disposizione spaziale degli atomi nella molecola,nessuna delle altre alternative è corretta,la struttura degli atomi di carbonio,la somma dei numeri atomici di tutti gli atomi presenti nella molecola
"Sapendo che il pH è il logaritmo del reciproco della concentrazione molare di ioni H+, qual è il pH di una soluzione 0,06 M (molare) di HCl (acido cloridrico)? Assumere che l'acido sia completamente dissociato.",1.22,0.6,6,2,3
La solubilità di un gas in un liquido:,aumenta all'aumentare della pressione,non dipende dalla temperatura,non dipende dalla pressione,aumenta al diminuire della pressione,aumenta all'aumentare della temperatura
"Sciogliendo 1 grammo di sale da cucina nelle seguenti quantità di acqua, quale soluzione sarà più concentrata?",10 cm3,1 dm3,100 ml,"0,1 litri",15 ml
Individuare il nome IUPAC corretto del composto che ha la seguente formula chimica: (C2H5)2C(CH3)CH2CH3,3-etil-3-metilpentano,3-metilesano,2-metil-1-etilpentano,1-metil-1-etilpentano,3-metil-3-etilbutano
18 g di acqua sono necessari per trasformare 56 g di ossido di calcio in idrossido di calcio. Quanti grammi di acqua sono necessari per trasformare 25 g di ossido di calcio?,8.036,9,12.001,15.022,13.345
"Alla temperatura di 298 K e alla pressione di 1,2 atm, 0,7 moli di NH3 vengono mescolate con 0,8 moli di O2. La miscela così ottenuta viene portata alla temperatura di 273,15 K e alla pressione di 1 atm. Vengono quindi sottratte 0,3 moli di miscela. Qual è il volume della miscela residua?","26,91 dm3 o 26,91 litri","1,2 litri","33,6 litri",I dati forniti sono insufficienti per rispondere al quesito,"18,66 dm3"
"Gli alcoli sono caratterizzati dalla presenza di un gruppo funzionale.
Quale?",OH,COOH,SH,NH2,CHO
