Question,Answer A,Answer B,Answer C,Answer D,Answer E
La variazione di entalpia di un sistema:,è uguale al calore ceduto dal sistema in una trasformazione isobara,è sempre positiva,si misura in K,è sempre uguale al calore ceduto dal sistema,è sempre uguale al lavoro effettuato sul sistema
Qual è la definizione di Faraday?,La carica totale di una mole di elettroni,La carica totale di una mole di protoni,La carica di un elettrone,La carica di un protone,La carica degli elettroni di un grammo di sostanza
Qual è il principio sul quale si basa la distillazione?,La diversa temperatura di ebollizione di due liquidi,La diversa concentrazione di saturazione di due solidi cristallini,La diversa massa molecolare di due composti,La diversa energia di eccitazione degli elettroni di due composti,La diversa miscibilità con l'acqua di due liquidi
Qual è il metallo presente nella vitamina B12?,Cobalto,Ferro,Rame,Zinco,Molibdeno
Che tipo di reazione è la reazione di neutralizzazione?,Acido-base,Ossidoriduzione,Condensazione,Cristallizzazione,Nessuna delle altre alternative è corretta
I non metalli:,possono avere numeri di ossidazioni sia positivi che negativi,hanno sempre numero di ossidazione positivo,hanno sempre numero di ossidazione negativo,hanno sempre numero di ossidazione uguale al gruppo di appartenenza dell'elemento,non hanno numero di ossidazione
L'anidride carbonica è composta da:,carbonio e ossigeno,carbonio e idrogeno,carbonio e azoto,carbonato e ossigeno,carburo e idrogeno
"La clorofilla e l'emoglobina contengono un legante di coordinazione planare, caratterizzato da quale struttura chimica?",Porfirina,Ione etilendiamminotertracetato,Piridina,Ione cianuro,Ammoniaca
Il polietere 18-corona-6 viene spesso usato in chimica organica per quale sua caratteristica?,Lega i cationi e li rende solubili in solventi organici,Lega i cationi e li rende solubili in solventi acquosi,Lega gli anioni e li rende solubili solo in acetone,Lega gli anioni e li rende solubili in solventi acquosi,Lega le piccole molecole organiche e le rende solubili in acqua
La velocità della reazione A+B → C+D:,è correlata all'aumento della concentrazione di prodotto nell'unità di tempo,è data dalla concentrazione dei prodotti in un dato istante,è data dal tempo richiesto per trasformare interamente i reagenti in prodotti,è data dalla variazione di concentrazione della soluzione in cui aumentano i prodotti,è data dalla concentrazione di reagenti in un dato istante.
"Quale, tra i seguenti, NON è un elemento di transizione?",Antimonio,Zinco,Cromo,Manganese,Ferro
Indicare il numero di ossidazione dell'azoto nel composto NaNO2.,3,–3,2,4,5
Quale delle seguenti grandezze è indipendente dalla temperatura?,Molalità,Molarità,Formalità,Normalità,Conducibilità elettrica
La legge di conservazione della massa afferma che:,in una reazione chimica che avviene in un sistema chiuso la somma delle masse dei reagenti è uguale alla somma delle masse dei prodotti,"in una reazione chimica che avviene in un sistema chiuso quando due elementi reagiscono tra loro per formare un composto, il rapporto tra le loro masse è sempre costante","quando due elementi formano più composti, le masse di uno di essi che si combinano con la stessa massa dell'altro stanno tra loro in un rapporto espresso da numeri interi e piccoli",l'energia liberata da una reazione chimica è uguale alla differenza tra la somma delle masse dei reagenti e la somma delle masse dei prodotti,la costante di equilibrio di una reazione è sempre indipendente da pressione e temperatura di reazione
Il valore di R nelle equazioni di stato dei gas è:,una costante,un numero adimensionale,un numero che varia rispetto al numero di moli,sempre un numero intero,una variabile di stato
Bilanciare la seguente reazione a Fe + b O2 + c H2O → d Fe2O3 + 3H2O,a=4; b=3; c=3; d=2,a=4; b=3; c=3; d=3,a=3; b=4; c=3; d=3,a=3; b=5; c=3; d=2,a=2; b=1; c=4; d=1
"A 0°C e 1,0 atm, 33,6 l di metano (CH4) contengono lo stesso numero di molecole di:
(MA di N = 14,0 u; MA di Na = 23,0 u; MA di Cl = 35,5 u)","45,0 g di monossido di azoto (NO)","22,4 l di monossido di carbonio (CO)","29,0 g di H2O","55,0 g di idrossido di sodio (NaOH)","36,5 g di cloruro di idrogeno (HCl)"
"Indicare il nome degli elementi contrassegnati dal colore corrispondente al numero 4.
",Non metalli,Attinidi,Gas nobili,Semimetalli,Metalli alcalini
Si considerino il carbonio e il silicio. Quale delle seguenti affermazioni è ERRATA?,Un atomo di silicio ha il doppio dei protoni posseduti da un atomo di carbonio,Sia l'atomo di carbonio sia l'atomo di silicio hanno configurazione elettronica esterna ns2 np2,Il carbonio appartiene al periodo 2 mentre il silicio appartiene al periodo 3,Il carbonio è più elettronegativo del silicio,Né il carbonio né il silicio sono metalli
Una soluzione 1 M contiene:,Una mole di soluto per ogni litro di soluzione,Una mole di soluto per ogni Kg di solvente,Una mole di soluto per ogni litro di solvente,Un kg di soluto per litro di soluzione,Un equivalente di soluto per litro di solvente
Il numero di equivalenti di soluto disciolti in un litro di soluzione è la definizione di:,normalità,molarità,frazione normale,molalità,solubilità
"Individuare i coefficienti stechiometrici che bilanciano le masse della seguente equazione chimica:
aK2Cr2O7 + bNaBr + cH2SO4 → dBr2 + eCr2(SO4)3 + fK2SO4 + gNa2SO4 + hH2O",a = 1; b = 6; c = 7; d = 3; e = 1; f = 1; g = 3; h = 7,a = 3; b = 6; c = 7; d = 3; e = 1; f = 1; g = 3; h = 7,a = 1; b = 6; c = 7; d = 3; e = 3; f = 1; g = 3; h = 7,a = 1; b = 6; c = 7; d = 3; e = 1; f = 3; g = 3; h = 7,a = 1; b = 6; c = 7; d = 3; e = 1; f = 1; g = 3; h = 14
"La nomenclatura tradizionale degli ossidi prevede che, quando il metallo ha due numeri di ossidazione diversi, sia chiamato:","""ossido"" + nome metallo e suffisso -ico, per il numero di ossidazione maggiore; ""ossido"" + nome del metallo e suffisso -oso, per quello minore","""ossido"" + nome metallo e suffisso -oso, per il numero di ossidazione maggiore; ""ossido"" + nome del metallo e suffisso -ico, per quello minore","in base al numero di atomi del composto, prefisso ""mono-"" o ""bi-"" + ossido di
+ nome metallo","""ossido di"" + prefissi ""mono"", bi, tri etc. in base al numero di ossidazione dell'ossigeno + nome metallo",nessuna delle altre alternative è corretta: i metalli hanno sempre un solo numero di ossidazione
"Tenendo conto che il silicio appartiene allo stesso gruppo del carbonio, individuare lo ione idrogenosilicato:","–
HSiO3",H2SiO3,"+
HSiO3",HSiO2,"2–
HSiO3"
Il magnesio ha numero atomico 12. La sua configurazione elettronica è:,1s22s22p63s2,1s22s22p63s1,1s22s2,1s22s22p63s23p1,1s22s22p63s23p3
Quale tra le seguenti alternative riguardo i numeri di ossidazione è corretta?,I metalli non hanno mai numero di ossidazione negativo,"I non metalli possono avere numero di ossidazione positivo o negativo, tranne O ed F che hanno sempre numero di ossidazione positivo","In qualunque composto, l'ossigeno ha sempre numero di ossidazione pari a +1",Tra i numeri di ossidazione di ogni elemento c'è sempre quello che corrisponde al gruppo di appartenenza della tavola periodica,L'idrogeno ha sempre numero di ossidazione positivo
Le reazioni esotermiche comportano:,passaggio di calore dal sistema verso l'ambiente,passaggio di calore dall'ambiente verso il sistema,una reazione chimica in cui si formano legami con assorbimento di energia,una reazione chimica senza assorbimento o rilascio di calore,una trasformazione sempre isobara
"Per definizione, da cosa sono composti gli idrocarburi?",Solo da carbonio e idrogeno,Principalmente da carbonio e idrogeno ma possono avere anche altri elementi come ossigeno e azoto,Solo da carbonio ed ossigeno,"Solamente da carbonio, ma possono esserci impurità di azoto e zolfo",Principalmente da idrogeno e ossigeno
"Secondo le regole della nomenclatura tradizionale, il composto Na2O2 prende il nome di:",perossido di sodio,diossido di sodio,diossido di disodio,perossido di disodio,perossido di sodio 2
"Qual è il volume di una soluzione acquosa di KOH 0,2 M indispensabile per neutralizzare (pH = 7) un volume di 50 ml di una soluzione 0,1 M di HClO3?","25,0 ml","125,0 ml","50,0 ml","15,0 ml","250,0 ml"
Una delle seguenti tecniche che vengono impiegate per separare le sostanze pure che costituiscono le miscele sfrutta la differente velocità con cui le sostanze pure delle miscele migrano attraverso un materiale di supporto. Quale?,Cromatografia,Estrazione con solventi,Distillazione,Filtrazione,Centrifugazione
"In una soluzione, solvente e soluto sono:","rispettivamente, il componente presente in maggiore e minore quantità","rispettivamente, il componente presente in minore e maggiore quantità","sinonimi, e identificano la sostanza presente in quantità minore in soluzione","sinonimi, e identificano la sostanza presente in quantità maggiore in soluzione",la parte liquida (solvente) e quella solida (soluto) che si discioglie nella soluzione
"Nelle ammine alifatiche, l'azoto si lega con:",un gruppo alchilico,un gruppo alifatico,una catena primaria,un acido carbossilico,un sale
"La nomenclatura tradizionale degli ossidi prevede che, qualora il metallo coinvolto nella reazione abbia un solo numero di ossidazione:","il nome del composto sia ""ossido di"" seguito dal nome del metallo",il composto prenda il nome di ossido + nome del metallo a cui è aggiunto il suffisso -oso,il composto prenda il nome di ossido + nome del metallo a cui è aggiunto il suffisso -ico,il nome del composto sia formato dal nome del metallo a cui è aggiunto il suffisso -ossido,Nessuna delle altre alternative è corretta: i metalli hanno sempre almeno 3 numeri di ossidazione
"Qual è la concentrazione di HNO3 nei 250 ml di soluzione acquosa che hanno neutralizzato 62,5 ml di una soluzione acquosa di LiOH 0,4 M?","0,1 M","0,4 M","0,01 M","0,3 M","0,09 M"
Quante moli di OH– sono presenti in 100 litri di una soluzione acquosa di Sr(OH)2 con pH = 9?,0.001,0.05,0.5,1e-05,0.005
Qual è il numero di ossidazione assunto dai metalli alcalini nei loro composti?,1,2,3,–1,–2
Che cosa afferma il secondo principio della termodinamica?,Una trasformazione è spontanea se provoca un aumento dell'entropia dell'universo,Una trasformazione è spontanea se provoca una diminuzione dell'entropia dell'universo,Una trasformazione non è spontanea se provoca un aumento dell'entropia dell'universo,Una trasformazione è spontanea se provoca un aumento dell'entropia del sistema della reazione,Una trasformazione è spontanea se provoca una diminuzione dell'entropia del sistema della reazione
Nel caso di un legame covalente puro gli elettroni di legame:,sono condivisi equamente tra gli atomi,si spostano verso l'atomo più elettronegativo,si spostano verso l'atomo meno elettronegativo,vengono strappati da uno dei due atomi lasciando un catione,sono dati da uno solo dei due atomi
Qual è la formula bruta dell'anidride ipoclorosa?,Cl2O,Cl2O3,ClO,Cl2O7,Cl2O5
"In una reazione di ossidoriduzione, la sostanza che viene definita riducente:",aumenta il proprio numero di ossidazione,acquista elettroni,è necessariamente un non metallo,cede cariche elettriche positive,deve avere prima della reazione il suo più elevato numero di ossidazione
"Rispetto alle tecniche analitiche che si basano sulla misurazione dell'assorbimento di radiazione luminosa, quelle basate sulla luminescenza sono:","più sensibili, ma non sempre applicabili poichè molte molecole irradiate danno emissione trascurabile","meno sensibili, e non sempre applicabili poichè molte molecole irradiate danno emissione trascurabile","più sensibili, e sempre applicabili poichè tutte le molecole irradiate danno un'emissione misurabile","ugualmente sensibili, e sempre applicabili","ugualmente sensibili, e sempre applicabili poichè tutte le molecole irradiate danno un'emissione misurabile"
Che cosa sono i reattivi di Grignard?,Composti di organomagnesio,Composti di organolitio,Composti organici sempre insaturi,Catalizzatori a base di ferro,Catalizzatori a base di zinco
"Quando un composto chimico può essere definito ""organico""?",Quando uno o più atomi di carbonio sono uniti tramite legame covalente ad atomi di altri elementi,Quando uno o più atomi di carbonio sono uniti tramite legame ionico ad atomi di altri elementi,Quando è formato soltanto da atomi di azoto e idrogeno legati con legame covalente,Quando è formato soltanto da atomi di carbonio legati con legame ionico ad atomi di ossigeno e idrogeno,Nessuna delle altre alternative è corretta
Gli idrocarburi sono composti organici che:,sono costituiti solo da carbonio e idrogeno,"sono costituiti solo da carbonio, idrogeno e ossigeno",contengono anche un eteroatomo,hanno una struttura ad anello,non possono avere una struttura ad anello
In una reazione chimica che cosa indicano i coefficienti stechiometrici?,I rapporti molari con cui le sostanze coinvolte nella reazione reagiscono,I rapporti in peso con cui le sostanze coinvolte nella reazione reagiscono,Le percentuali in peso con cui le sostanze coinvolte nella reazione reagiscono,I volumi con cui le sostanze coinvolte nella reazione reagiscono,I rapporti delle concentrazioni con cui le sostanze coinvolte nella reazione reagiscono
Si prenda in considerazione un litro di soluzione tampone formata da un acido debole e un suo sale ottenuto formalmente per reazione con una base forte. La soluzione viene diluita con acqua distillata a un nuovo volume di 3 litri. il pH della nuova soluzione ottenuta:,resta invariato,non si può dire come varia con questi dati,diventa più basico,diventa più acido,non si può parlare di pH in questi casi
"Indicare il nome degli elementi contrassegnati dal colore corrispondente al numero 3.
",Semimetalli,Metalli alcalini,Non metalli,Alogeni,Lantanidi
"Bilanciare la seguente reazione inserendo i corretti coefficienti stechiometrici.
a CaCO3 + b NaCl → c CaCl2 + d Na2CO3",a = 1; b = 2; c = 1; d = 1,a = 1; b = 2; c = 1; d = 2,a = 1; b = 2; c = 2; d = 1,a = 2; b = 4; c = 1; d = 1,a = 1; b = 2; c = 4; d = 1
La solubilità di un composto in un solvente polare:,aumenta all'aumentare della polarità del composto,diminuisce all'aumentare della polarità del composto,non varia con la polarità del composto,è massima per i composti non polarizzati,nessuna delle altre alternative è corretta
"Mettendo a confronto un atomo di zolfo con un atomo di ossigeno, emerge che:",un atomo di zolfo ha nel nucleo il doppio dei protoni posseduti da un atomo di ossigeno,l'ossigeno appartiene al periodo 2 mentre lo zolfo appartiene al periodo 4,lo zolfo ha energia di prima ionizzazione superiore a quella dell'ossigeno,"sia lo zolfo, sia l'ossigeno appartengono al gruppo 15 della tavola periodica","l'ossigeno è un non metallo, mentre lo zolfo è un semimetallo"
"La configurazione elettronica esterna 1s2 2s22p4, a quale elemento della tavola periodica appartiene?",Ossigeno,Carbonio,Alluminio,Litio,Magnesio
"Una soluzione acquosa di acido cloridrico è: (MA del cloro 35,5 u)","0,01 m se contiene 0,01 mol di acido cloridrico in 1000 g di acqua","1,0 m se contiene 36,5 g di acido cloridrico in 963,5 g di acqua","2,0 m se contiene 73,0 g di acido cloridrico in 1000 g di soluzione","0,01 M se contiene 3,65 g di acido cloridrico in 1,0 l di soluzione","3,0 M se contiene 3,0 mol di acido cloridrico in una mole di soluzione"
"In cromatografia, che cosa si intende per volume di ritenzione?",Volume di solvente richiesto per eluire un soluto dalla colonna,Volume di sostanza iniettata nella colonna,Volume di ciascuna frazione cromatografica,Volume totale di tutte le frazioni cromatografiche,Volume di solvente necessario a sciogliere tutto il soluto
La struttura tridimensionale delle proteine è spesso definita dalla presenza di ponti disulfuro. Che tipo di legame si instaura tra due atomi di zolfo in questi ponti?,Covalente,Ionico,Di coordinazione,Forze di van del Waals,Interazione idrofobica
Il manganese è un elemento di transizione e appartiene al periodo 4 e al gruppo 7 della tavola periodica. Quale valore assume il numero quantico secondario di un orbitale 3d dell'atomo di manganese?,2,3d7,3,4,tutti i valori compresi tra –3 e +3
"Per ottenere un'aldeide a partire da un alcol primario, quale reazione chimica è necessario compiere?",Ossidazione,Riduzione,Sostituzione nucleofila,Addizione elettrofila,Alogenazione catalitica
Da quali dei seguenti atomi sono formati gli idrocarburi?,"C, H","N, H","H, O","C, N","C, O"
Quale dei seguenti atomi ha elettronegatività minore?,Cs,Al,Ge,C,K
"NH4NO3 ha un peso formula pari a 80,04 u e la sua solubilità in acqua è 1.920 g/l a 20 °C. 10 litri di una soluzione 0,4 M di NH4NO3 a 20 °C e a 1 atm di pressione:","sono sovrassaturi di soluto, con presenza di corpo di fondo",hanno pH neutro,"contengono 32,016 g di NH4NO3",sono saturi di soluto,hanno [H+] < 10–7 mol/l
"La massa di NH4Cl è pari a 53,5 u. Per preparare un litro di una soluzione acquosa 0,02M di NH4Cl saranno pertanto necessari:","1,07 g di NH4Cl","0,98 moli di acqua","53,5 g di NH4Cl","5,35 g di NH4Cl","10,7 g di NH4Cl"
Quanti atomi di idrogeno sono presenti in una molecola di 1-idrossi-2- metilbenzene?,8,7,9,10,11
"Se la massa di una mole di H2MoO4 è pari a 162 g, qual è la massa del
molibdeno presente in 12,04 x 1023 molecole di tale composto?",192 g,194 g,96 g,224 g,196 g
"Per ottenere 15,0 moli di acqua, quante moli di 2-esino devono essere sottoposte a combustione completa?",3,2.75,2,Nessuna delle altre risposte è corretta,2.5
"Una soluzione ha pH pari a 3, calcolare la concentrazione di ioni H+.",10–3 mol/L,10–6 mol/L,"0,03 mol/L","0,003 mol/L","0,00001 mol/L"
Gli orbitali p:,sono orientati lungo le 3 direzioni dello spazio,formano angoli di 45°,sono sferici,possono contenere massimo 3 elettroni,nessuna delle altre risposte è corretta
Le particelle di un liquido hanno forze di attrazione intermolecolari:,minori di quelle presenti nello stato solido,maggiori di quelle presenti nello stato solido,minori di quelle presenti nello stato gassoso,esclusivamente di van der Waals,nessuna delle altre alternative è corretta
"La massa di H è pari a 1 u, la massa di S è pari a 32 u e la massa di O è pari a 16 u. La massa di una molecola di H2SO3 è pertanto pari a:","82,0 u","49,0 u","82,0 grammi","6,02 x 1023 u","82,0 x 1,67 x 10-24 u"
"Nella terminologia chimica tradizionale, una reazione di neutralizzazione è una reazione che avviene in soluzione acquosa tra:",una base e un acido,un acido e un alcol,due acidi,un acido e un alcano,nessuna delle altre risposte è corretta
"Il fluoro (F) appartiene al gruppo 17 e al periodo 2 della tavola periodica, la sua configurazione elettronica esterna è:",2s2 2p5,2s2,3d2 3s3,6s1,4d10
L'ozono:,è una forma allotropica dell'ossigeno,è una forma tautomerica dell'azoto,si forma per combustione dei combustibili fossili,non è presente in natura,è un derivato del petrolio
Cosa sono gli elettroliti?,Sono specie chimiche che in soluzione si scindono totalmente o parzialmente in ioni,Sono elettroni in soluzione acquosa,Sono acidi,Sono le soluzioni contenute nella cella elettrolitica,Sono soluzioni tampone
Gli acidi grassi sono molecole:,"organiche, contenenti il gruppo carbossilico e liposolubili",che rientrano nella composizione del colesterolo,che si legano tra loro per formare le proteine,che si legano tra loro per formare gli acidi nucleici,"costituite da H, C e O e che non presentano mai legami multipli nella loro struttura"
"Un litro di CO e un litro di CO2, nelle stesse condizioni di temperatura e pressione:",contengono lo stesso numero di molecole,contengono lo stesso numero di atomi,hanno la stessa massa,hanno la stessa densità,nessuna delle altre alternative è corretta
"La massa di una molecola di MnO(OH)2 è pari a 105 uma. Qual è la massa di manganese che si trova in 2,5 moli di tale sostanza?","137,5 g",110 uma,180 g,"177,5 g","97,5 g"
"Un catione bivalente di rame ha Z = 29 e A = 63, quindi ha:",27 elettroni,32 neutroni nel nucleo,29 neutroni nel nucleo,27 protoni nel nucleo,29 elettroni
Il furano è:,un eterociclo pentaatomico,un eterociclo esaatomico,un composto solforato,un etere aciclico,un alcano
"Se si aumenta di 100 volte la concentrazione degli ioni (OH-) in una soluzione con un pH iniziale di 8, quale valore di pH finale si ottiene?",pH 10,pH 6,pH 7,pH 12,pH 5
Nella dissociazione di 1 mole di solfato di alluminio in acqua si formano:,2 moli di catione metallico e 3 moli di ione solfato,una mole di catione alluminio e 1 mole di anione solfato,alluminio metallico e acido solforico,la stessa quantità in grammi di entrambi anione e catione,nessuna delle altre alternative è corretta perché il sale non si solubilizza in acqua
La reazione tra idrossido di sodio e acido cloridrico genera il sale:,NaCl,KCl,Na2SO4,NaNO3,Na2O
Individuare la sostanza maggiormente solubile in acqua.,Cloruro di potassio,Zolfo,Alluminio,Dodecano,"Peltro (lega di stagno, piombo e rame)"
In un filo d'argento il legame fra gli atomi è di tipo:,metallico,covalente,covalente polare,ionico,nessuna delle altre alternative è corretta
La formula corretta dell'acido cloridrico è:,HCl,H2Cl,HClO,HClO2,H2SO3
Quale dei seguenti composti organici ha più spiccate proprietà acide?,HCOOH,C2H5OH,CH3OH,CH3OCH3,CH3NH2
Quale dei seguenti elementi è un alogeno?,I,Fe,Mg,Cs,Al
Il naftalene è:,un idrocarburo aromatico,un alcol,un alchene,un idrocarburo saturo,nessuna delle altre alternative è corretta
"L'acido carbonico (H2CO3) è un acido debole con K1 = 4,3 x 10–7. Si considerino 50,0 litri di una soluzione acquosa di acido carbonico che contengono 0,0005 moli di H+. Qual è il pOH di tale soluzione?",9,9.75,10.69,5,4.3
Un polimero è un composto organico costituito da una sequenza ordinata di:,monomeri,isomeri,epimeri,stereoisomeri,allomeri
"Individuare i coefficienti stechiometrici necessari per bilanciare la seguente equazione chimica:
aBa3N2 + bH2O → cBa(OH)2 + dNH3",a = 1; b = 6; c = 3; d = 2,a = 2; b = 6; c = 6; d = 2,a = 1; b = 3; c = 3; d = 2,a = 2; b = 6; c = 3; d = 4,a = 2; b = 6; c = 6; d = 4
"La seguente equazione chimica rappresenta la reazione di combustione del metano:
CH4 + 2O2 → CO2 + 2H2O
Con 2,4 moli di O2 quante moli di metano si possono bruciare?",1.2,0.6,4.8,0.48,2.4
La frazione molare del soluto indica:,il rapporto tra il numero di moli di soluto e le moli totali in una soluzione,il rapporto tra il numero di moli di soluto e il numero di moli di solvente in una soluzione,il rapporto tra il numero di moli di soluto e il volume della soluzione espresso in litri,il rapporto tra il numero di moli di soluto e la massa della soluzione espressa in chilogrammi,il rapporto tra il numero di moli totali in una soluzione e il numero di moli di soluto
Gli enzimi catalizzano le reazioni chimiche. Questo significa che:,"le accelerano, diminuendo l'energia di attivazione (Ea) di una reazione",forniscono energia ai reagenti,sottraggono energia ai reagenti,le rendono energeticamente possibili,aumentano la temperatura delle reazioni
La somma dei numeri di ossidazione di tutti gli atomi di uno ione è:,pari alla carica dello ione,pari in valore assoluto ma di segno opposto alla carica dello ione,pari alla carica dello ione meno 2,zero,nessuna delle altre alternative è corretta
Qual è il numero di ossidazione del carbonio in H2CO3?,4,2,–4,–2,1
Cosa indica il numero atomico?,Il numero di protoni,Il numero di neutroni e protoni,Il numero di elettroni,"Il numero di protoni, neutroni ed elettroni",Il numero dei neutroni
I trigliceridi sono:,esteri formati da 3 acidi a lunga catena e una molecola di glicerolo,esteri formati da 3 alcoli a lunga catena e una molecola di glicerolo,esteri formati da una molecola di acido a lunga catena e 3 molecole di glicerolo,esteri formati da una molecola di alcol a lunga catena e 3 molecole di glicerolo,trimeri del glicerolo
"Quale delle seguenti soluzioni, delle quali si riportano le concentrazioni di ioni H+ e OH–, è la più basica?","[H+] = 1,0 · 10–12","[OH–] = 1,0 · 10–5","[H+] = 1,0 · 10–7","[OH–] = 1,0 · 10–10","[OH–] = 1,0 · 10–4"
"Data una soluzione acquosa a pH 5,0, qual è la concentrazione di ioni OH–?","[OH–] = 1,0 x 10–9","[OH–] = 1,0 x 109","[OH–] = 1,0 x 107","[OH–] = 1,0 x 105","[OH–] = 1,0 x 10–5"
I grassi contengono il gruppo funzionale:,estereo,carbossilico,alcolico,etereo,ammidico
Cosa si intende per molecola?,Un gruppo di atomi tenuto insieme da legami covalenti,Un atomo che ha perso elettroni,Un gruppo di protoni tenuto insieme da legami chimici,Un atomo che ha acquistato elettroni,La più piccola parte di un elemento chimico
Le conformazioni a sedia e a barca che possono essere assunte dal cicloesano sono:,isomeri conformazionali,anelli aromatici,isomeri cis-trans,isomeri di catena,isomeri di gruppo funzionale
Per bruciare completamente 58 g di butano (C4H10) a CO2 e H2O secondo l'equazione: 2C4H10 + 13O2 → 8CO2 + 10H2O si richiedono:,"6,5 moli di ossigeno",13 g di ossigeno,13 moli di ossigeno,"6,5 grammoioni di ossigeno",10 moli di H e 13 di O2
Qual è il massimo numero di ossidazione dell'azoto nei suoi composti?,5,–5,3,4,È variabile da –3 a +3
"Quali sono i coefficienti stechiometrici che bilanciano la seguente reazione chimica?
a Fe2O3 +b Al → c Al3O3 + d Fe",a = 1; b = 2; c = 1; d = 2,a = 2; b = 1; c = 2; d = 1,a = 1; b = 2; c = 2; d = 2,a = 1; b = 3; c = 1; d = 3,a = 2; b = 2; c = 1; d = 2
Cosa accade se il nucleo di un atomo espelle una particella alfa?,La massa dell’atomo diminuisce,La massa dell’atomo rimane inalterata ma cambia la sua carica elettrica,La massa dell’atomo rimane inalterata ma cambia l’assetto di protoni e neutroni,Non cambia né la massa né la carica elettrica dell’atomo perché in realtà viene emessa solo un’onda elettromagnetica,Il nucleo di un atomo non può espellere una particella alfa
